{
  "id": "00000000-0000-4000-8000-000000000102",
  "schema_version": "1.0.0",
  "revision": 1,
  "projectId": "00000000-0000-4000-8000-000000000001",
  "episodeId": "00000000-0000-4000-8000-000000000002",
  "sourceCutId": "00000000-0000-4000-8000-000000000101",
  "sourceCutRevision": 2,
  "name": "Director cut",
  "timelineFingerprint": "aaaaaaaaaaaaaaaaaaaaaaaaaaaaaaaaaaaaaaaaaaaaaaaaaaaaaaaaaaaaaaaa",
  "snapshot": {
    "id": "00000000-0000-4000-8000-000000000101",
    "schema_version": "1.0.0",
    "revision": 2,
    "projectId": "00000000-0000-4000-8000-000000000001",
    "episodeId": "00000000-0000-4000-8000-000000000002",
    "fps": 30,
    "clips": [],
    "soundCues": [],
    "captions": [],
    "ducking": null,
    "masterLimiter": { "integratedLufs": -14, "truePeakDbtp": -1 }
  }
}
